{
  "schema_version": "0.1",
  "unit_id": "test-unit-0001",
  "tenant_id": "sentinel",
  "experiment_id": "sentinel-test-minimal",
  "manifest_sha256": "0123456789abcdef0123456789abcdef0123456789abcdef0123456789abcdef",
  "created_at": "2026-05-17T20:00:00Z",
  "payload": {
    "prompt_id": "probe-0042",
    "model_temperature": 0.7,
    "max_tokens": 256,
    "test_payload_value": 42
  }
}
